{
  "schema_version": "lazarus.oracle/v1",
  "case_id": "eval-n06",
  "negative_control": false,
  "decision_changing_blockers": [
    {
      "oracle_id": "n-ob06",
      "decision_changing": true,
      "acceptable_matches": [
        "CANARY_FAILED"
      ]
    },
    {
      "oracle_id": "n-ob06-rto-unknown",
      "decision_changing": true,
      "acceptable_matches": [
        "REQUIRED_EVIDENCE_UNKNOWN"
      ]
    }
  ],
  "advisory_findings": [],
  "coverage": [
    "canary_invariant"
  ],
  "abstention_required": false,
  "required_probe": null,
  "recovery_expectation": {
    "restore": "pass",
    "canary": "fail",
    "rpo": "pass",
    "rto": "unknown",
    "cleanup": "pass"
  }
}
