{
  "schema_version": "lazarus.oracle/v1",
  "case_id": "cal-02",
  "negative_control": false,
  "decision_changing_blockers": [
    {
      "oracle_id": "ob-02",
      "decision_changing": true,
      "acceptable_matches": [
        "REQUIRED_EVIDENCE_UNKNOWN",
        "SEMANTIC_CONFIRMATION_REQUIRED"
      ]
    }
  ],
  "advisory_findings": [],
  "coverage": [
    "fuzzy_ownership"
  ],
  "abstention_required": false,
  "required_probe": null,
  "recovery_expectation": {
    "restore": "pass",
    "canary": "pass",
    "rpo": "pass",
    "rto": "pass",
    "cleanup": "pass"
  }
}
