{
  "schema_version": "lazarus.oracle/v1",
  "case_id": "eval-n04",
  "negative_control": false,
  "decision_changing_blockers": [
    {
      "oracle_id": "n-ob04",
      "decision_changing": true,
      "acceptable_matches": [
        "RESOURCE_GENERATION_MISMATCH"
      ]
    },
    {
      "oracle_id": "n-ob04-unknown",
      "decision_changing": true,
      "acceptable_matches": [
        "REQUIRED_EVIDENCE_UNKNOWN"
      ]
    }
  ],
  "advisory_findings": [],
  "coverage": [
    "generation_mismatch"
  ],
  "abstention_required": false,
  "required_probe": null,
  "recovery_expectation": {
    "restore": "pass",
    "canary": "pass",
    "rpo": "pass",
    "rto": "pass",
    "cleanup": "pass"
  }
}
