{
  "schema_version": "lazarus.oracle/v1",
  "case_id": "cal-04",
  "negative_control": false,
  "decision_changing_blockers": [
    {
      "oracle_id": "ob-04",
      "decision_changing": true,
      "acceptable_matches": [
        "SEMANTIC_CONFIRMATION_REQUIRED"
      ],
      "required_relation_types": [
        "resource_alias_candidate"
      ]
    }
  ],
  "advisory_findings": [],
  "coverage": [
    "semantic_alias_example"
  ],
  "abstention_required": false,
  "required_probe": "verify_recovery_scope",
  "recovery_expectation": {
    "restore": "pass",
    "canary": "pass",
    "rpo": "pass",
    "rto": "pass",
    "cleanup": "pass"
  }
}
