{
  "schema_version": "lazarus.oracle/v1",
  "case_id": "eval-n10",
  "negative_control": true,
  "decision_changing_blockers": [],
  "advisory_findings": [],
  "coverage": [
    "retired_dependency"
  ],
  "abstention_required": false,
  "required_probe": null,
  "recovery_expectation": {
    "restore": "pass",
    "canary": "pass",
    "rpo": "pass",
    "rto": "pass",
    "cleanup": "pass"
  }
}
