{
  "schema_version": "lazarus.oracle/v1",
  "case_id": "cal-01",
  "negative_control": false,
  "decision_changing_blockers": [
    {
      "oracle_id": "ob-01",
      "decision_changing": true,
      "acceptable_matches": [
        "DESTRUCTIVE_INTENT_MISMATCH"
      ]
    }
  ],
  "advisory_findings": [],
  "coverage": [
    "structured_intent_mismatch"
  ],
  "abstention_required": false,
  "required_probe": null,
  "recovery_expectation": {
    "restore": "pass",
    "canary": "pass",
    "rpo": "pass",
    "rto": "pass",
    "cleanup": "pass"
  }
}
